{
  "$schema": "http://json-schema.org/draft-07/schema#",
  "title": "Meme Template Configuration",
  "type": "object",
  "required": [
    "name",
    "template_file",
    "text_areas"
  ],
  "properties": {
    "name": {
      "type": "string",
      "description": "Human-readable name of the meme template"
    },
    "template_file": {
      "type": "string",
      "description": "Plain file name of the template image in the templates directory (no sub-directories); .jpg, .jpeg, .png or .webp. The real format is sniffed from the file content."
    },
    "description": {
      "type": "string",
      "description": "Description of the meme and its typical usage"
    },
    "text_areas": {
      "type": "array",
      "description": "Array of text overlay areas",
      "items": {
        "type": "object",
        "required": [
          "id",
          "position",
          "width",
          "height",
          "default_font_size"
        ],
        "properties": {
          "id": {
            "type": "string",
            "description": "Unique identifier for this text area"
          },
          "position": {
            "type": "object",
            "properties": {
              "x": {
                "type": "integer",
                "minimum": 0
              },
              "y": {
                "type": "integer",
                "minimum": 0
              }
            },
            "required": [
              "x",
              "y"
            ],
            "description": "Center of the text area in image pixels (must lie inside the image)"
          },
          "width": {
            "type": "integer",
            "minimum": 1,
            "description": "Maximum line width in pixels (text is wrapped to fit)"
          },
          "height": {
            "type": "integer",
            "minimum": 1,
            "description": "Maximum text block height in pixels"
          },
          "default_font_size": {
            "type": "integer",
            "minimum": 6,
            "maximum": 300,
            "description": "Font size (px) used when auto_resize is false"
          },
          "max_font_size": {
            "type": "integer",
            "minimum": 6,
            "maximum": 300,
            "description": "Largest size tried by auto-resize",
            "default": 80
          },
          "min_font_size": {
            "type": "integer",
            "minimum": 6,
            "maximum": 300,
            "description": "Smallest size tried by auto-resize",
            "default": 12
          },
          "text_align": {
            "type": "string",
            "enum": [
              "left",
              "center",
              "right"
            ],
            "default": "center"
          },
          "text_color": {
            "type": "string",
            "default": "white",
            "description": "Named color (white, black, red, green, lime, blue, yellow, orange, purple, pink, cyan, magenta, gray, brown) or hex #RGB, #RRGGBB, #RRGGBBAA"
          },
          "stroke_color": {
            "type": "string",
            "default": "black",
            "description": "Named color (white, black, red, green, lime, blue, yellow, orange, purple, pink, cyan, magenta, gray, brown) or hex #RGB, #RRGGBB, #RRGGBBAA"
          },
          "stroke_width": {
            "type": "integer",
            "minimum": 0,
            "maximum": 16,
            "default": 2,
            "description": "Outline radius in pixels (0 = no outline)"
          },
          "max_chars": {
            "type": "integer",
            "minimum": 1,
            "description": "Recommended maximum characters (exceeding it produces a warning, not an error)"
          },
          "recommended_text": {
            "type": "string",
            "description": "Example or template text"
          },
          "usage": {
            "type": "string",
            "description": "How this text area should be used"
          }
        }
      }
    },
    "usage_rules": {
      "type": "array",
      "items": {
        "type": "string"
      },
      "description": "Rules and guidelines for using this meme template"
    },
    "examples": {
      "type": "array",
      "description": "Example text combinations",
      "items": {
        "type": "object",
        "additionalProperties": {
          "type": "string",
          "description": "Caption text keyed by text area id"
        },
        "properties": {
          "explanation": {
            "type": "string",
            "description": "Why the example works"
          }
        }
      }
    },
    "cultural_context": {
      "type": "string",
      "description": "Origin of the meme and why it is funny"
    },
    "text_positioning_note": {
      "type": "string",
      "description": "Guidance on where the text goes"
    }
  },
  "description": "Meme template config. The file name (without .json) is the template id and may only contain letters, digits, '_' and '-'. Semantic checks (colors, font ranges, area inside image) are enforced by the server at load time; failures appear in meme_generator_status load_errors."
}
